{
  "kind": "cibSevenScenarioEvidence",
  "scenario": {
    "id": "parallel-fork-join-a-then-b",
    "sha256": "559ea1e2482d7764d890a55efda13f199e562986c878037be555787cf173c3bc"
  },
  "profile": {
    "id": "parallel-fork-join-draft",
    "sha256": "0a5420d7459bba77d38539a7a3639409554700e58467ca8790e37eca7ca34952"
  },
  "producer": {
    "engine": "CIB Seven",
    "engineVersion": "2.2.0",
    "engineRevision": "834a9874760de8a0107f7c1b32806e37f17fb017",
    "runner": "cibseven-oracle",
    "java": "21",
    "database": "H2 2.3.232"
  },
  "producerObservations": {
    "taskQueries": [
      {
        "afterCommandId": "start-process",
        "tasks": [
          {
            "elementId": "UserTask_A",
            "name": "A"
          },
          {
            "elementId": "UserTask_B",
            "name": "B"
          }
        ]
      },
      {
        "afterCommandId": "complete-user-task-a",
        "tasks": [
          {
            "elementId": "UserTask_B",
            "name": "B"
          }
        ]
      },
      {
        "afterCommandId": "complete-user-task-b",
        "tasks": []
      }
    ],
    "timerJobs": [
      {
        "afterCommandId": "start-process",
        "jobs": []
      },
      {
        "afterCommandId": "complete-user-task-a",
        "jobs": []
      },
      {
        "afterCommandId": "complete-user-task-b",
        "jobs": []
      }
    ]
  },
  "projection": {
    "id": "canonical-scenario-result"
  },
  "result": {
    "outcome": {
      "kind": "semantic",
      "outcome": "committed"
    },
    "trace": [
      {
        "kind": "deployment",
        "outcome": "committed"
      },
      {
        "kind": "command",
        "commandId": "start-process",
        "outcome": "committed"
      },
      {
        "kind": "state",
        "instanceId": "Instance_1",
        "status": "running",
        "activeWaits": [
          {
            "elementId": "UserTask_A",
            "kind": "userTask",
            "multiplicity": 1
          },
          {
            "elementId": "UserTask_B",
            "kind": "userTask",
            "multiplicity": 1
          }
        ],
        "openUserTasks": [
          {
            "id": {
              "processInstanceId": "Instance_1",
              "elementId": "UserTask_A",
              "activation": 1
            },
            "name": "A",
            "state": "active"
          },
          {
            "id": {
              "processInstanceId": "Instance_1",
              "elementId": "UserTask_B",
              "activation": 1
            },
            "name": "B",
            "state": "active"
          }
        ],
        "openTimers": [],
        "enabledInteractions": [
          {
            "kind": "completeUserTaskInstance",
            "taskId": {
              "processInstanceId": "Instance_1",
              "elementId": "UserTask_A",
              "activation": 1
            }
          },
          {
            "kind": "completeUserTaskInstance",
            "taskId": {
              "processInstanceId": "Instance_1",
              "elementId": "UserTask_B",
              "activation": 1
            }
          }
        ],
        "logicalTimeMs": 0
      },
      {
        "kind": "command",
        "commandId": "complete-user-task-a",
        "outcome": "committed"
      },
      {
        "kind": "state",
        "instanceId": "Instance_1",
        "status": "running",
        "activeWaits": [
          {
            "elementId": "UserTask_B",
            "kind": "userTask",
            "multiplicity": 1
          }
        ],
        "openUserTasks": [
          {
            "id": {
              "processInstanceId": "Instance_1",
              "elementId": "UserTask_B",
              "activation": 1
            },
            "name": "B",
            "state": "active"
          }
        ],
        "openTimers": [],
        "enabledInteractions": [
          {
            "kind": "completeUserTaskInstance",
            "taskId": {
              "processInstanceId": "Instance_1",
              "elementId": "UserTask_B",
              "activation": 1
            }
          }
        ],
        "logicalTimeMs": 0
      },
      {
        "kind": "command",
        "commandId": "complete-user-task-b",
        "outcome": "committed"
      },
      {
        "kind": "state",
        "instanceId": "Instance_1",
        "status": "completed",
        "activeWaits": [],
        "openUserTasks": [],
        "openTimers": [],
        "enabledInteractions": [],
        "logicalTimeMs": 0
      }
    ]
  }
}
