{
  "kind": "cibSevenScenarioEvidence",
  "scenario": {
    "id": "user-task-stale-completion",
    "sha256": "d8fca0b4b93dc5e046a76c423d210afb004339e7f8e22ff4d71d236598d19828"
  },
  "profile": {
    "id": "cibseven-2.2.0-user-task-draft",
    "sha256": "28b1bbe88f6b120c290c0057f91730e0bd1dff0fa593d9b4749c5193878fa980"
  },
  "producer": {
    "engine": "CIB Seven",
    "engineVersion": "2.2.0",
    "engineRevision": "834a9874760de8a0107f7c1b32806e37f17fb017",
    "runner": "cibseven-oracle",
    "java": "21",
    "database": "H2 2.3.232"
  },
  "producerObservations": {
    "taskQueries": [
      {
        "afterCommandId": "start-process",
        "tasks": [
          {
            "elementId": "UserTask_Approve",
            "name": "Approve"
          }
        ]
      },
      {
        "afterCommandId": "complete-user-task-instance",
        "tasks": []
      },
      {
        "afterCommandId": "complete-stale-user-task-instance",
        "tasks": []
      }
    ],
    "timerJobs": [
      {
        "afterCommandId": "start-process",
        "jobs": []
      },
      {
        "afterCommandId": "complete-user-task-instance",
        "jobs": []
      },
      {
        "afterCommandId": "complete-stale-user-task-instance",
        "jobs": []
      }
    ]
  },
  "projection": {
    "id": "canonical-scenario-result"
  },
  "result": {
    "outcome": {
      "kind": "semantic",
      "outcome": "rejected"
    },
    "trace": [
      {
        "kind": "deployment",
        "outcome": "committed"
      },
      {
        "kind": "command",
        "commandId": "start-process",
        "outcome": "committed"
      },
      {
        "kind": "state",
        "instanceId": "Instance_1",
        "status": "running",
        "activeWaits": [
          {
            "elementId": "UserTask_Approve",
            "kind": "userTask",
            "multiplicity": 1
          }
        ],
        "openUserTasks": [
          {
            "id": {
              "processInstanceId": "Instance_1",
              "elementId": "UserTask_Approve",
              "activation": 1
            },
            "name": "Approve",
            "state": "active"
          }
        ],
        "openTimers": [],
        "openEffects": [],
        "enabledInteractions": [
          {
            "kind": "completeUserTaskInstance",
            "taskId": {
              "processInstanceId": "Instance_1",
              "elementId": "UserTask_Approve",
              "activation": 1
            }
          }
        ],
        "logicalTimeMs": 0
      },
      {
        "kind": "command",
        "commandId": "complete-user-task-instance",
        "outcome": "committed"
      },
      {
        "kind": "state",
        "instanceId": "Instance_1",
        "status": "completed",
        "activeWaits": [],
        "openUserTasks": [],
        "openTimers": [],
        "openEffects": [],
        "enabledInteractions": [],
        "logicalTimeMs": 0
      },
      {
        "kind": "command",
        "commandId": "complete-stale-user-task-instance",
        "outcome": "rejected"
      },
      {
        "kind": "state",
        "instanceId": "Instance_1",
        "status": "completed",
        "activeWaits": [],
        "openUserTasks": [],
        "openTimers": [],
        "openEffects": [],
        "enabledInteractions": [],
        "logicalTimeMs": 0
      }
    ]
  }
}
